"","ID_number","Authors","Author.s..ID","Title","Year","Source.title","Volume","Issue","Art..No.","Page.start","Page.end","Page.count","Cited.by","Abstract.Filter","Filtered.By..Initials.","Second.NA.Filter","Second.Filter.By..Initials.","Third.Abstract.Filter","Third.Abstract.Filter.by.Initials","DOI","Filtering.Reason..RAs.do.not.fill.this.out..only.for.a.reference.guide.","Link","Filter.Explanation..RAs.do.not.fill.this.out.","Document.Type","Publication.Stage","Access.Type","Source","EID","X"
"2740",3620,"Pearce, D.","7202580416","The social cost of carbon and its policy implications",2003,"Oxford Review of Economic Policy","19","3","","362","384",NA,207,"0","CT",1,"NST",NA,"","10.1093/oxrep/19.3.362","","https://www.scopus.com/inward/record.url?eid=2-s2.0-0141879482&partnerID=40&md5=46a324f730e584633561200f1ae6901c",NA,"Article","Final","","Scopus","2-s2.0-0141879482",NA
"2760",3649,"Van Der Zwaan, B.C.C., Gerlagh, R., Klaassen, G., Schrattenholzer, L.","35876735300; 6602746685; 56236525400; 56069217300","Endogenous technological change in climate change modelling",2002,"Energy Economics","24","1","","1","19",NA,181,"0","CT",1,"NST",NA,"","10.1016/S0140-9883(01)00073-1","","https://www.scopus.com/inward/record.url?eid=2-s2.0-0036147019&partnerID=40&md5=a32f91efaf14153e6de4ee340344deaa",NA,"Article","Final","","Scopus","2-s2.0-0036147019",NA
"2761",3650,"Jaeger, W.K.","7102605856","Carbon taxation when climate affects productivity",2002,"Land Economics","78","3","","354","367",NA,16,"0","CT",1,"NST",NA,"","10.2307/3146895","","https://www.scopus.com/inward/record.url?eid=2-s2.0-0036383706&partnerID=40&md5=46ca692d6b1212c6420d0970de2e4433",NA,"Article","Final","","Scopus","2-s2.0-0036383706",NA
"2814",3709,"Snow, N",NA,"Report calls for new framework to estimate social costs of carbon",2017,"OIL & GAS JOURNAL","115","1D","","19","21",NA,0,NA,"CT",0,"NST",1,"AD","","",NA,NA,"J",NA,"","WebofScience",NA,NA
"2819",3745,"Gerlagh, Reyer",NA,"A Rapid Assessment Model for Understanding the Social Cost of Carbon: Calculating the Social Costs of Carbon without Knowing Preferences",2014,"Climate Change Economics","5","2",NA,"1",NA,NA,NA,"0","CT",1,"NST",NA,"","","","https://search.proquest.com/docview/1650523534?accountid=14505",NA,"Scholarly Journals",NA,NA,"EconLit",NA,NA
"2829",3790,"Pearce, David",NA,"The Social Cost of Carbon and Its Policy Implications",2003,"Oxford Review of Economic Policy","19","3",NA,"362",NA,NA,NA,"0","CT",0,"NST",1,"AD","","","https://search.proquest.com/docview/56450907?accountid=14505",NA,"Scholarly Journals",NA,NA,"EconLit",NA,NA
"2832",3803,"Tol, Richard S J",NA,"The Social Cost of Carbon: Trends, Outliers and Catastrophes",2008,"Economics: The Open-Access, Open-Assessment E-Journal","2","",NA,"",NA,NA,NA,"0","CT",1,"NST",NA,"","","","https://search.proquest.com/docview/56756675?accountid=14505",NA,"Scholarly Journals",NA,NA,"EconLit",NA,NA
"2834",3818,"Weyant, John",NA,"Integrated Assessment of Climate Change: State of the Literature",2014,"Journal of Benefit-Cost Analysis","5","3",NA,"377",NA,NA,NA,"0","CT",1,"NST",NA,"","","","https://search.proquest.com/docview/1692275141?accountid=14505",NA,"Scholarly Journals",NA,NA,"EconLit",NA,NA
